{
  "schema_version": "1.0.0",
  "receipt_id": "2026-04-10-api-gateway-validation-regression-fix-live-apply",
  "applied_on": "2026-04-10",
  "recorded_on": "2026-04-10",
  "recorded_by": "claude",
  "source_commit": "5a97f8f28fe0645c743cce3115ca177bb6093bcd",
  "repo_version_context": "0.178.92",
  "workflow_id": "converge-api-gateway",
  "summary": "API gateway converged with validation regression fix (v0.178.87) — 699.9s convergence; routes and upstream health probes verified.",
  "targets": [
    {
      "kind": "vm",
      "name": "runtime-control-lv3",
      "address": "10.10.10.92"
    }
  ],
  "verification": [
    {
      "check": "API gateway health probes passing",
      "result": "pass",
      "observed": "API gateway converged in 699.9s; all upstream routes validated; validation regression test suite passing."
    }
  ],
  "evidence_refs": [
    "versions/stack.yaml"
  ],
  "notes": [
    "Regression in API gateway route validation schema introduced in v0.178.86; fixed in v0.178.87."
  ]
}
